Nº	Nome	Gênero	Diretor	Ano Lançamento	Nota	titleId	rating_IMDB	Escritor	Ator/Atriz			
179	A Fantástica Fábrica de Chocolate	Aventura	Tim Burton	2005	7.5	tt0367594	6.7	John August	Johnny Depp, Freddie Highmore, David Kelly, Helena Bonham Carter			
180	American Pie 4	Comédia	Steve Rash	2005	7.0	tt1605630	6.7	Adam Herz	Eugene Levy, Tad Hilgenbrink, Arielle Kebbel			
181	Os Sem-Floresta	Comédia	Tim Johnson	2006	6.5	tt0327084	6.7	David Hoselton	Bruce Willis, Garry Shandling, Steve Carell, Wanda Sykes			
182	Anjos e Demônios	Thriller	Ron Howard	2009	6.5	tt0808151	6.7	Dan Brown	Tom Hanks, Ewan McGregor, Ayelet Zurer, Stellan Skarsgård			
183	Esquadrão Classe A	Ação	Joe Carnahan	2010	6.0	tt0429493	6.7	Stephen J. Cannell	Liam Neeson, Bradley Cooper, Sharlto Copley, Jessica Biel			
184	American Pie: O Reencontro	Comédia	Jon Hurwitz	2012	7.0	tt1605630	6.7	Adam Herz	Jason Biggs, Alyson Hannigan, Seann William Scott, Chris Klein			
185	Warcraft	Aventura	Duncan Jones	2016	7.5	tt0803096	6.7	Charles Leavitt	Travis Fimmel, Paula Patton, Ben Foster, Dominic Cooper			
186	Zumbilândia: Atire Duas Vezes	Comédia	Ruben Fleischer	2019	6.0	tt1560220	6.7	Dave Callaham	Woody Harrelson, Jesse Eisenberg, Emma Stone, Abigail Breslin			
187	Space Jam	Comédia	Amy Smith-Boyllan	1996	7.5	tt5832032	6.7	Kirk Tingblad	Bob Bergen, Bonnie Silco			
188	Esqueceram de Mim	Comédia	Chris Columbus	1990	7.5	tt0099785	7.7	John Hughes	Macaulay Culkin, Joe Pesci, Daniel Stern, John Heard			
189	Onze Homens e um Segredo	Crime	Steven Soderbergh	2001	7.5	tt0240772	7.7	Charles Lederer	George Clooney, Brad Pitt, Julia Roberts, Matt Damon			
190	Se Beber, Não Case!	Comédia	Todd Phillips	2009	7.5	tt1119646	7.7	Scott Moore	Zach Galifianakis, Bradley Cooper, Justin Bartha, Ed Helms			
191	A Teoria de Tudo	Drama	James Marsh	2014	7.0	tt2980516	7.7	Jane Hawking	Eddie Redmayne, Felicity Jones, Tom Prior, Sophie Perry			
192	O Som do Silêncio	Drama	Darius Marder	2019	7.5	tt5363618	7.7	Derek Cianfrance	Riz Ahmed, Olivia Cooke, Paul Raci, Lauren Ridloff			
193	Os 7 de Chicago	Biografia	Aaron Sorkin	2020	8.0	tt1070874	7.7	Aaron Sorkin	Eddie Redmayne, Alex Sharp, Sacha Baron Cohen, Jeremy Strong			
194	GoodFellas	Crime	Martin Scorsese	1990	9.5	tt0099685	8.7	Nicholas Pileggi	Robert De Niro, Ray Liotta, Joe Pesci, Lorraine Bracco			
195	Interestelar	Aventura	Christopher Nolan	2014	9.0	tt0816692	8.7	Christopher Nolan	Matthew McConaughey, Anne Hathaway, Jessica Chastain, Mackenzie Foy			
196	Espartalhões	Comédia	Jason Friedberg	2008	4.5	tt1073498	2.8	Jason Friedberg	Sean Maguire, Kevin Sorbo, Carmen Electra, Ken Davitian			
197	Como se Fosse a Primeira Vez	Comédia	Peter Segal	2004	7.0	tt0343660	6.8	George Wing	Adam Sandler, Drew Barrymore, Rob Schneider			
198	Vovó... Zona 2	Comédia	John Whitesell	2006	7.0	tt0421729	4.8	Darryl Quarles	Martin Lawrence, Emily Procter, Nia Long, Zachary Levi			
199	A Herança de Mr. Deeds	Comédia	Steven Brill	2002	7.0	tt0280590	5.8	Tim Herlihy	Adam Sandler, Winona Ryder, John Turturro, Allen Covert			
200	As Branquelas	Comédia	Keenen Ivory Wayans	2004	7.5	tt0381707	5.8	Marlon Wayans	Marlon Wayans, Shawn Wayans, Busy Philipps, Maitland Ward			
201	Antes Só do que Mal Casado	Comédia	Farrellys	2007	7.5	tt0408839	5.8	Scot Armstrong	Ben Stiller, Michelle Monaghan, Malin Akerman, Jerry Stiller			
202	Harry Potter e as Relíquias da Morte - Parte 1	Aventura	David Yates	2010	8.0	tt1571403	8.1	J.K. Rowling	Daniel Radcliffe, Emma Watson, Rupert Grint			
203	Se Beber, Não Case! Parte III	Comédia	Todd Phillips	2013	6.5	tt1951261	5.8	Scott Moore	Bradley Cooper, Zach Galifianakis, Ed Helms, Justin Bartha			
204	Esqueceram de Mim 2: Perdido em Nova York	Comédia	Chris Columbus	1992	7.5	tt0104431	6.8	John Hughes	Macaulay Culkin, Joe Pesci, Daniel Stern, Catherine O'Hara			
205	O Rei Leão	Aventura	Roger Minkoff	1994	8.0	tt0110357	8.5	Linda Woolverton	Matthew Broderick, Jeremy Irons, James Earl Jones			
206	Todo Poderoso	Comédia	Tom Shadyac	2003	7.5	tt0315327	6.8	Steve Oedekerk	Jim Carrey, Jennifer Aniston, Morgan Freeman, Philip Baker Hall			
207	A Casa do Lago	Drama	Alejandro Agresti	2006	6.5	tt0410297	6.8	Ji Na Yeo	Keanu Reeves, Sandra Bullock, Christopher Plummer, Ebon Moss-Bachrach			
208	Sim Senhor	Comédia	Peyton Reed	2008	7.0	tt1068680	6.8	Danny Wallace	Jim Carrey, Zooey Deschanel, Bradley Cooper, John Michael Higgins			
209	A Entidade	Horror	Scott Derrickson	2012	7.5	tt1922777	6.8	C. Robert Cargill	Ethan Hawke, Juliet Rylance, James Ransone, Fred Thompson			
210	O Babadook	Horror	Jennifer Kent	2014	7.5	tt2321549	6.8	Jennifer Kent	Essie Davis, Noah Wiseman, Daniel Henshall, Hayley McElhinney			
211	Os Intocáveis	Crime	Brian De Palma	1987	7.5	tt0094226	7.8	David Mamet	Kevin Costner, Sean Connery, Robert De Niro, Charles Martin Smith			
212	De Volta para o Futuro - Parte II	Aventura	Robert Zemeckis	1989	9.0	tt0096874	7.8	Bob Gale	Michael J. Fox, Christopher Lloyd, Lea Thompson, Tom Wilson			
213	Desventuras em Série	Comédia	Brad Silberling	2004	7.0	tt0339291	6.8	Robert Gordon	Jim Carrey, Jude Law, Meryl Streep			
214	O Curioso Caso de Benjamin Button	Drama	David Fincher	2008	7.5	tt0421715	7.8	F. Scott Fitzgerald	Brad Pitt, Cate Blanchett, Tilda Swinton, Julia Ormond			
215	A Rede Social	Biografia	David Fincher	2010	7.5	tt1285016	7.8	Ben Mezrich	Jesse Eisenberg, Andrew Garfield, Justin Timberlake, Rooney Mara			
216	Straight Outta Compton	Biografia	F. Gary Gray	2015	8.5	tt1398426	7.8	Jonathan Herman	O'Shea Jackson Jr., Corey Hawkins, Jason Mitchell, Neil Brown Jr.			
217	Últimas Conversas	Biografia	Eduardo Coutinho	2015	7.0	tt4611160	7.8	Eduardo Coutinho	Eduardo Coutinho			
218	Corra!	Thriller	Jordan Peele	2017	7.0	tt5052448	7.8	Jordan Peele	Daniel Kaluuya, Allison Williams, Bradley Whitford, Catherine Keener			
219	Adoráveis Mulheres	Drama	Greta Gerwig	2019	8.0	tt3281548	7.8	Louisa May Alcott	Saoirse Ronan, Emma Watson, Florence Pugh, Eliza Scanlen			
220	O Irlandês	Crime	Martin Scorsese	2019	8.0	tt1302006	7.8	Charles Brandt	Robert De Niro, Al Pacino, Joe Pesci, Harvey Keitel			
221	Clube da Luta	Drama	David Fincher	1999	9.0	tt0137523	8.8	Jim Uhls	Brad Pitt, Edward Norton, Meat Loaf, Zach Grenier			
222	Super-Heróis: A Liga da Injustiça	Comédia	Jason Friedberg	2008	2.5	tt1213644	1.9	Jason Friedberg	Carmen Electra, Vanessa Lachey, Nicole Parker, Matt Lanter			
223	O Filho de Chucky	Comédia	Don Mancini	2004	5.0	tt0387575	4.9	Don Mancini	Jennifer Tilly, Brad Dourif, John Waters, Billy Boyd			
224	Ano Um	Comédia	Harold Ramis	2009	6.0	tt1045778	4.9	Harold Ramis	Jack Black, Michael Cera, Olivia Wilde, Oliver Platt			
225	Amanhecer - Parte 1	Aventura	Bill Condon	2011	6.5	tt1324999	4.9	Stephenie Meyer	Kristen Stewart, Robert Pattinson, Taylor Lautner, Gil Birmingham			
226	Premonição	Thriller	James Wong	2000	6.5	tt0195714	6.7	James Wong	Devon Sawa, Ali Larter, Kerr Smith			
227	+ Velozes + Furiosos	Ação	John Singleton	2003	7.0	tt0322259	5.9	Derek Haas	Paul Walker, Tyrese Gibson, Cole Hauser, Eva Mendes			
228	A Nova Cinderela	Comédia	Mark Rosman	2004	6.0	tt0356470	5.9	Leigh Dunlap	Hilary Duff, Chad Michael Murray, Jennifer Coolidge, Dan Byrd			
229	O Albergue	Horror	Eli Roth	2005	7.5	tt0450278	5.9	Eli Roth	Jay Hernandez, Derek Richardson, Eythor Gudjonsson, Barbara Nedeljakova			
230	Brüno	Comédia	Larry Charles	2009	8.0	tt0889583	5.9	Sacha Baron Cohen	Sacha Baron Cohen, Gustaf Hammarsten, Clifford Bañagale, Chibundu Orukwowu			
231	Um Jantar para Idiotas	Comédia	Jay Roach	2010	7.0	tt0427152	5.9	Francis Veber	Steve Carell, Paul Rudd, Stephanie Szostak, Zach Galifianakis			
232	It Follows	Horror	David Robert Mitchell	2014	7.5	tt3235888	6.8	David Robert Mitchell	Maika Monroe, Keir Gilchrist, Olivia Luccardi			
233	Esquadrão Suicida	Aventura	David Ayer	2016	6.0	tt1386697	5.9	John Ostrander	Will Smith, Jared Leto, Margot Robbie, Viola Davis			
234	O Feitiço de Áquila	Aventura	Richard Donner	1985	7.5	tt0089457	6.9	David Webb Peoples	Matthew Broderick, Rutger Hauer, Michelle Pfeiffer, Leo McKern			
235	Shrek 2	Comédia	Andrew Adamson	2004	7.5	tt0410595	7.3	Andrew Adamson	Mike Myers, Eddie Murphy, Cameron Diaz			
236	A Lenda do Tesouro Perdido	Aventura	Jon Turteltaub	2004	7.5	tt0368891	6.9	Oren Aviv	Nicolas Cage, Diane Kruger, Justin Bartha, Sean Bean			
237	O Exorcista	Horror	William Friedkin	1973	7.5	tt0070047	8.1	William Peter Blatty	Ellen Burstyn, Max Von Sydow, Linda Blair			
238	Quase Famosos	Drama	Cameron Crowe	2000	7.5	tt0181875	7.9	Cameron Crowe	Billy Crudup, Patrick Fugit, Kate Hudson, Frances McDormand			
239	As Aventuras de Pi	Drama	Ang Lee	2012	7.5	tt0454876	7.9	David Magee	Suraj Sharma, Irrfan Khan, Adil Hussain, Tabu			
240	História de um Casamento	Drama	Noah Baumbach	2019	8.5	tt7653254	7.9	Noah Baumbach	Adam Driver, Scarlett Johansson, Julia Greer, Azhy Robertson			
241	Hannibal	Thriller	Ridley Scott	2001	6.5	tt0212985	5.0	Thomas Harris	Anthony Hopkins, Julianne Moore, Gary Oldman			
242	Inatividade Paranormal	Comédia	Michael Tiddes	2013	7.5	tt2243537	5.0	Rick Alvarez	Marlon Wayans, Essence Atkins, Marlene Forte, David Koechner			
243	O Amor é Cego	Comédia	Farrellys	2001	6.0	tt0256380	6.0	Sean Moynihan	Jack Black, Gwyneth Paltrow, Jason Alexander, Joe Viterelli			
244	Velozes & Furiosos: Desafio em Tóquio	Ação	Justin Lin	2006	7.5	tt0463985	6.0	Chris Morgan	Lucas Black, Zachery Ty Bryan, Shad Moss, Damien Marzette			
245	The Poughkeepsie Tapes	Horror	John Erick Dowdle	2007	7.5	tt1010271	6.0	John Erick Dowdle	Stacy Chbosky, Ben Messmer, Samantha Robson, Ivar Brogger			
246	Um Faz de Conta Que Acontece	Comédia	Adam Shankman	2008	6.0	tt0960731	6.0	Tim Herlihy	Adam Sandler, Keri Russell, Courteney Cox, Guy Pearce			
247	Uma Noite no Museu 2	Comédia	Shawn Levy	2009	7.0	tt1078912	6.0	Thomas Lennon	Ben Stiller, Owen Wilson, Amy Adams, Hank Azaria			
248	A Possessão de Deborah Logan	Horror	Adam Robitel	2014	7.0	tt3387648	6.0	Gavin Heffernan	Jill Larson, Anne Ramsay, Michelle Ang, Brett Gentile			
249	Um Maluco no Golfe	Comédia	Dennis Dugan	1996	7.0	tt0116483	7.0	Tim Herlihy	Adam Sandler, Christopher McDonald, Julie Bowen, Frances Bay			
250	A Hora do Rush	Ação	Brett Ratner	1998	7.0	tt0120812	7.0	Jim Kouf	Jackie Chan, Chris Tucker, Ken Leung, Tom Wilkinson			
251	Entrando numa Fria	Comédia	Jay Roach	2000	7.0	tt0212338	7.0	John Hamburg	Ben Stiller, Robert De Niro, Teri Polo, Blythe Danner			
252	Penetras Bons de Bico	Comédia	David Dobkin	2005	7.0	tt0396269	7.0	Bob Fisher	Owen Wilson, Vince Vaughn, Rachel McAdams, Christopher Walken			
253	O Segredo da Cabana	Thriller	Drew Goddard	2011	7.0	tt1259521	7.0	Joss Whedon	Kristen Connolly, Chris Hemsworth, Anna Hutchison, Fran Kranz			
254	O Poço	Thriller	Galder Gaztelu-Urrutia	2019	8.0	tt8228288	7.0	Pedro Rivero	Ivan Massagué, Zorion Eguileor, Antonia San Juan, Emilio Buale			
255	Um Dia de Cão	Drama	Sidney Lumet	1975	7.5	tt0072890	8.0	Leslie Waller	Al Pacino, John Cazale, Penelope Allen, Sully Boyar			
256	Requiem for a Dream	Drama	Darren Aronofsky	2000	7.5	tt5543402	8.3	Darren Aronofsky	Ellen Burstyn, Jared Leto, Jennifer Connelly, Marlon Wayans			
257	O Jogo da Imitação	Biografia	Morten Tyldum	2014	7.5	tt2084970	8.0	Andrew Hodges	Benedict Cumberbatch, Keira Knightley, Matthew Goode, Allen Leech			
258	Batman - O Cavaleiro das Trevas	Ação	Christopher Nolan	2008	9.0	tt0468569	9.0	Christopher Nolan	Christian Bale, Heath Ledger, Aaron Eckhart, Michael Caine			
259	Tempos Modernos	Comédia	Charles Chaplin	1936	8.0	tt0027977	8.5	Charles Chaplin	Charles Chaplin, Paulette Goddard, Henry Bergman			
260	Psicose	Thriller	Alfred Hitchcock	1960	8.0	tt0054215	8.5	Joseph Stefano	Anthony Perkins, Janet Leigh, Veras Miles			
261	Lolita	Drama	Stanley Kubrick	1962	7.5	tt0056193	7.5	Vladimir Nabokov	James Mason, Shelley Winters, Sue Lyon			
262	2001	Aventura	Stanley Kubrick	1968	7.5	tt0062622	8.3	Arthur C. Clarke	Keir Dullea, Gary Lockwood, William Sylvester			
263	The Texas Chainsaw Massacre	Horror	Tobe Hooper	1974	7.0	tt0072271	7.4	Tobe Hooper	Marilyn Burns, Edwin Neal, Allen Danziger			
264	Taxi Driver	Drama	Martin Scorsese	1976	8.0	tt0075314	8.2	Paul Schrader	Robert De Niro, Jodie Foster, Cybill Shepherd			
265	Halloween	Horror	John Carpenter	1978	7.5	tt0077651	7.7	John Carpenter	Jamie Lee Curtis, Donald Pleasence, Tony Moran			
266	Airplane!	Comédia	Jim Abrahams	1980	8.0	tt0080339	7.7	Jim Abrahams	Robert Hays, Julie Hagerty, Leslie Nielsen			
267	Sexta-Feira 13	Horror	Sean S. Cunningham	1980	7.0	tt0080761	6.4	Victor Miller	Betsy Palmer, Adrienne King, Jeannine Taylor			
268	Halloween II	Horror	Rick Rosenthal	1981	4.5	tt0082495	6.5	John Carpenter	Jamie Lee Curtis, Donald Pleasence, Charles Cyphers			
269	Blade Runner	Ação	Ridley Scott	1982	7.5	tt9567018	8.1	Hampton Fancher	Harrison Ford, Rutger Hauer, Sean Young			
270	Conan the Barbarian	Aventura	John Milius	1982	7.5	tt0082198	6.9	Robert E. Howard	Arnold Schwarzenegger, James Earl Jones, Max von Sydow			
271	Poltergeist	Horror	Tobe Hooper	1982	7.0	tt0084516	7.3	Steven Spielberg	Nick Lincoln, Patrick Boulanger, Sylvain B. Boulanger, Guillaume Boulanger, Max Billing, Lacey Boogeyman			
272	Scarface	Crime	Brian De Palma	1983	9.5	tt5274792	8.3	Oliver Stone	Al Pacino, Michelle Pfeiffer, Steven Bauer			
273	Jurassic Park	Aventura	Steven Spielberg	1993	7.0	tt0107290	8.2	David Koepp	Sam Neill, Laura Dern, Jeff Goldblum			
274	Forrest Gump	Drama	Robert Zemeckis	1994	9.0	tt0109830	8.8	Winston Groom	Tom Hanks, Robin Wright, Gary Sinise			
275	Pulp Fiction	Ação	Quentin Tarantino	1994	7.5	tt0110912	8.9	Quentin Tarantino	John Travolta, Uma Thurman, Samuel L. Jackson			
276	Cassino	Crime	Martin Scorsese	1995	9.5	tt0112641	8.2	Martin Scorsese	Robert De Niro, Sharon Stone, Joe Pesci			
277	Heat	Crime	Michael Mann	1995	8.0	tt0113277	8.3	Michael Mann	Al Pacino, Robert De Niro, Val Kilmer			
278	Se7en	Crime	David Fincher	1995	8.0	tt0114369	8.6	Andrew Kevin Walker	Morgan Freeman, Brad Pitt, Kevin Spacey			
279	Trainspotting	Drama	Danny Boyle	1996	8.0	tt0117951	8.1	Irvine Welsh	Ewan McGregor, Ewan Bremner, Jonny Lee Miller			
280	O Mentiroso	Comédia	Tom Shadyac	1997	7.0	tt0119528	6.9	Paul Guay	Jim Carrey, Maura Tierney, Amanda Donohoe			
281	Anaconda	Ação	Luis Llosa	1997	4.0	tt0118615	4.9	Jim Cash	Jon Voight, Jennifer Lopez, Eric Stoltz, Ice Cube, Owen Wilson			
282	Matrix	Ação	Wachowskis	1999	9.0	tt5274778	8.7	Wachowskis	Keanu Reeves, Laurence Fishburne, Carrie-Anne Moss			
283	American Pie	Comédia	Paul Weitz	1999	8.0	tt0163651	7.0	Adam Herz	Jason Biggs, Chris Klein, Thomas Ian Nicholas			
284	Rock Star	Drama	Stephen Herek	2001	7.0	tt0202470	6.3	John Stockwell	Mark Wahlberg, Jennifer Aniston, Dominic West			
285	Shrek	Comédia	Andrew Adamson	2001	7.5	tt0126029	7.9	Ted Elliott	Mike Myers, Eddie Murphy, Cameron Diaz			
286	Animal	Comédia	Luke Greenfield	2001	6.5	tt0255798	4.8	Tom Brady	Rob Schneider, Colleen Haskell, John C. McGinley			
287	Legally Blonde	Comédia	Robert Loketic	2001	6.0	tt0250494	6.4	Amanda Brown	Reese Witherspoon, Luke Wilson, Selma Blair			
288	Rat Race	Comédia	Jerry Zucker	2001	6.0	tt0250687	6.4	Andy Breckman	Breckin Meyer, Amy Smart, Whoopi Goldberg			
289	8 Mile	Drama	Curtis Hanson	2002	8.0	tt0298203	7.2	Scott Silver	Eminem, Brittany Murphy, Kim Basinger			
290	Duplex	Comédia	Danny DeVito	2003	7.5	tt0266489	5.9	Stephan Gunn	Ben Stiller, Drew Barrymore, Eileen Essell			
291	Matrix Reloaded	Ação	Wachowskis	2003	7.5	tt0234215	7.2	Wachowskis	Keanu Reeves, Laurence Fishburne, Carrie-Anne Moss			
292	Tratamento de Choque	Comédia	Peter Segal	2003	6.0	tt5230578	6.2	David Dorfman	Jack Nicholson, Adam Sandler, Marisa Tomei			
293	Os Incríveis	Comédia	Brad Bird	2004	9.0	tt0317705	8.0	Brad Bird	Craig T. Nelson, Holly Hunter, Samuel L. Jackson			
294	Táxi	Comédia	Tim Story	2004	6.5	tt0316732	4.5	Luc Besson	Queen Latifah, Jimmy Fallon, Gisele Bündchen			
295	Com a Bola Toda	Comédia	Rawson Marshall Thurber	2004	5.5	tt0364725	6.7	Rawson Marshall Thurber	Ben Stiller, Christine Taylor, Vince Vaughn			
296	Madagascar	Comédia	Eric Darnell	2005	8.0	tt0351283	6.9	Mark Burton	Chris Rock, Ben Stiller, David Schwimmer			
297	Golpe Baixo	Comédia	Peter Segal	2005	7.0	tt0398165	6.4	Sheldon Turner	Adam Sandler, Burt Reynolds, Chris Rock			
298	À Procura da Felicidade	Drama	Gabriele Muccino	2006	8.0	tt0454921	8.0	Steve Conrad	Will Smith, Thandiwe, Jaden Smith			
299	Click	Comédia	Frank Coraci	2006	8.0	tt0389860	6.4	Steve Koren	Adam Sandler, Kate Beckinsale, Christopher Walken			
300	American Pie 5	Comédia	Joe Nussbaum	2006	6.5	tt0808146	5.1	Adam Herz	John White, Eugene Levy, Maria Ricossa			
301	Date Movie	Comédia	Jason Friedberg	2006	3.5	tt0466342	2.8	Jason Friedberg	Alyson Hannigan, Adam Campbell, Fred Willard			
302	Ratatouille	Comédia	Brad Bird	2007	8.0	tt0382932	8.1	Brad Bird	Brad Grret, Lou Romano, Patton Oswalt			
303	Superbad	Comédia	Greg Mottola	2007	7.5	tt0829482	7.6	Seth Rogen	Michael Cera, Jonah Hill, Christopher Mintz-Plasse			
304	Crepúsculo	Drama	Catherine Hardwicke	2008	7.5	tt1099212	5.3	Stephenie Meyer	Kristen Stewart, Robert Pattinson, Billy Burke, Taylor Lautner			
305	Lake Mungo	Horror	Joel Anderson	2008	6.5	tt0816556	6.3	Joel Anderson	Rosie Traynor, David Pledger, Martin Sharpe			
306	Presságio	Thriller	Alex Proyas	2009	7.0	tt0448011	6.2	Stiles White	Nicolas Cage, Chandler Canterbury, Rose Byrne			
307	A Saga Crepúsculo: Eclipse	Drama	David Slade	2010	6.0	tt1325004	5.1	Stephenie Meyer	Kristen Stewart, Robert Pattinson, Billy Burke, Taylor Lautner			
308	Karate Kid	Aventura	Harald Zwart	2010	6.5	tt1155076	6.2	Christopher Murphey	Jackie Chan, Jaden Smith			
309	Drive	Ação	Nicolas Winding Refn	2011	8.0	tt0780504	7.8	Hossein Amini	Ryan Gosling, Carey Mulligan, Bryan Cranston			
310	Paul	Comédia	Greg Mottola	2011	7.0	tt1092026	6.9	Simon Pegg	Simon Pegg, Nick Frost, Seth Rogen			
311	Prometheus	Thriller	Ridley Scott	2012	7.0	tt1446714	7.0	Dan O'Bannon	Noomi Rapace, Logan Marshall-Green, Michael Fassbender			
312	Ted	Comédia	Seth MacFarlane	2012	6.5	tt1637725	6.9	Seth MacFarlane	Mark Wahlberg, Mila Kunis, Seth MacFarlane			
313	A Visita	Horror	M. Night Shyamalan	2015	8.0	tt3567288	6.2	M. Night Shyamalan	Olivia DeJonge, Ed Oxenbould, Deanna Dunagan			
314	The Invitation	Thriller	Karyn Kusama	2015	7.5	tt2400463	6.6	Phil Hay	Logan Marshall-Green, Emayatzy Corinealdi, Michiel Huisman			
315	Hush	Horror	Mike Flanagan	2016	7.5	tt5022702	6.6	Mike Flanagan	John Gallagher Jr., Kate Siegel, Michael Trucco			
316	Inferno	Aventura	Ron Howard	2016	6.0	tt3062096	6.2	Dan Brown	Tom Hanks, Felicity Jones, Irrfan Khan			
317	Nu	Comédia	Michael Tiddes	2017	5.5	tt6048930	5.4	Rick Alvarez	Marlon Wayans, Regina Hall, Dennis Haysbert			
318	Halloween	Horror	David Gordon Green	2018	7.0	tt1502407	6.5	John Carpenter	Jamie Lee Curtis, Judy Greer, Andi Matichak			
319	Midsommar	Thriller	Ari Aster	2019	8.0	tt8772262	7.1	Ari Aster	Florence Pugh, Jack Reynor, Vilhelm Blomgren			
320	Oppenheimer	Biografia	Christopher Nolan	2023	7.5	tt15398776	8.5	Christopher Nolan	Cillian Murphy, Emily Blunt, Matt Damon, Robert Downey Jr.			
321												
322												
323												
324												
325												
326												
327												
328												
329												
330												
331												
332												
333												
334												
335												
336												
337												
338												
339												
340												
341												
342												
343												
344												
345												
346												
347												
348												
349												